{
  "$schema": "./policy.schema.json",
  "version": 1,
  "sources": [
    {
      "title": "H5P content types and applications",
      "href": "https://h5p.org/content-types-and-applications",
      "checked": "2026-10-15"
    },
    {
      "title": "H5P xAPI documentation",
      "href": "https://h5p.org/documentation/x-api",
      "checked": "2026-10-15"
    },
    {
      "title": "LiaScript documentation",
      "href": "https://liascript.github.io/",
      "checked": "2026-10-15"
    },
    {
      "title": "WCAG 2.2",
      "href": "https://www.w3.org/TR/WCAG22/",
      "checked": "2026-10-15"
    },
    {
      "title": "Google Research learning interactives",
      "href": "https://research.google/blog/the-future-of-practice-enabling-teachers-to-create-learning-interactives-with-generative-ui/",
      "checked": "2026-10-15"
    }
  ],
  "shells": [
    {
      "id": "course",
      "label": "Course with left outline",
      "useWhen": "Long, resumable, multi-module or compliance learning where learners need location and overview.",
      "completion": "ULAMS records progress per topic and derives course completion from the ordinary course structure."
    },
    {
      "id": "scroll",
      "label": "One-page scroll",
      "useWhen": "Short narrative learning that benefits from one continuous reading path and anchored sections.",
      "completion": "Stable section and topic identifiers report progress to ULAMS; reaching the page end alone never fabricates completion."
    },
    {
      "id": "slides",
      "label": "Slides",
      "useWhen": "Concise, visual, linear material suited to one idea per screen and keyboard or touch navigation.",
      "completion": "Stable slide and topic identifiers report progress to ULAMS; assessment and course completion remain server decisions."
    }
  ],
  "trackingEvents": ["viewed", "progressed", "attempted", "answered", "scored", "completed", "passed", "failed", "resumed"],
  "capabilities": [
    {
      "id": "native.rich-text",
      "family": "explain",
      "label": "Rich text",
      "purpose": "Explain concepts with short cited blocks, lists, tables, examples and code listings.",
      "objectiveVerbs": ["explain", "describe", "summarise"],
      "authoring": "api-generated",
      "runtime": { "kind": "content-type", "key": "richtext" },
      "tracking": ["viewed", "completed", "resumed"],
      "fallback": "Plain Markdown",
      "accessibility": ["Semantic headings and table headers; meaningful link text."],
      "citations": "required"
    },
    {
      "id": "layout.callout",
      "family": "explain",
      "label": "Callout",
      "purpose": "Emphasise one key idea, tip or warning without interrupting the reading flow.",
      "objectiveVerbs": ["recognise", "remember"],
      "authoring": "agent-composed",
      "runtime": { "kind": "layout-component", "key": "Callout" },
      "tracking": ["viewed"],
      "fallback": "Labelled Markdown paragraph",
      "accessibility": ["Meaning cannot depend on colour alone."],
      "citations": "required-for-claims"
    },
    {
      "id": "layout.steps",
      "family": "explain",
      "label": "Steps",
      "purpose": "Show a procedure or ordered process.",
      "objectiveVerbs": ["perform", "apply", "follow"],
      "authoring": "agent-composed",
      "runtime": { "kind": "layout-component", "key": "Steps" },
      "tracking": ["viewed"],
      "fallback": "Numbered Markdown list",
      "accessibility": ["Preserve semantic list order."],
      "citations": "required"
    },
    {
      "id": "layout.comparison-table",
      "family": "explain",
      "label": "Comparison table",
      "purpose": "Compare alternatives against common criteria.",
      "objectiveVerbs": ["compare", "distinguish", "choose"],
      "authoring": "agent-composed",
      "runtime": { "kind": "layout-component", "key": "ComparisonTable" },
      "tracking": ["viewed"],
      "fallback": "Markdown table with caption",
      "accessibility": ["Caption and row/column headers are required."],
      "citations": "required"
    },
    {
      "id": "layout.timeline",
      "family": "show",
      "label": "Timeline",
      "purpose": "Show a chronological sequence or stages where order matters.",
      "objectiveVerbs": ["sequence", "trace", "explain"],
      "authoring": "agent-composed",
      "runtime": { "kind": "layout-component", "key": "Timeline" },
      "tracking": ["viewed"],
      "fallback": "Ordered list with dates or stage labels",
      "accessibility": ["The DOM reading order must match chronology."],
      "citations": "required"
    },
    {
      "id": "layout.flip-cards",
      "family": "recall",
      "label": "Flip cards",
      "purpose": "Prompt low-stakes retrieval of terms, definitions or concise answers.",
      "objectiveVerbs": ["recall", "define", "identify"],
      "authoring": "agent-composed",
      "runtime": { "kind": "layout-component", "key": "FlipCards" },
      "tracking": ["viewed", "attempted"],
      "fallback": "Question and answer list",
      "accessibility": ["Reveal controls must be keyboard accessible and expose state."],
      "citations": "required"
    },
    {
      "id": "layout.code-block",
      "family": "show",
      "label": "Code block",
      "purpose": "Present source-supported code or commands for reading and copying.",
      "objectiveVerbs": ["inspect", "explain", "use"],
      "authoring": "agent-composed",
      "runtime": { "kind": "layout-component", "key": "CodeBlock" },
      "tracking": ["viewed"],
      "fallback": "Fenced code block",
      "accessibility": ["Code stays selectable text and does not rely on syntax colour."],
      "citations": "required"
    },
    {
      "id": "layout.practice-activity",
      "family": "practise",
      "label": "Scaffolded practice activity",
      "purpose": "Guide practice from prior knowledge through hints, feedback and a worked solution.",
      "objectiveVerbs": ["apply", "solve", "practise"],
      "authoring": "agent-composed",
      "runtime": { "kind": "layout-component", "key": "PracticeActivity" },
      "tracking": ["viewed", "attempted", "answered", "completed"],
      "fallback": "Toolbox, challenges, hints and worked solution as structured text",
      "accessibility": ["Hints and solutions expose state; focus moves predictably after an attempt."],
      "citations": "required"
    },
    {
      "id": "native.gift-quiz",
      "family": "practise",
      "label": "Tracked GIFT quiz",
      "purpose": "Run scored or unscored assessment attempts with explanations and server-side tracking.",
      "objectiveVerbs": ["recall", "apply", "evaluate"],
      "authoring": "api-generated",
      "runtime": { "kind": "topic-type", "key": "gift" },
      "tracking": ["viewed", "attempted", "answered", "scored", "completed", "passed", "failed", "resumed"],
      "fallback": "Questions and explanations as text",
      "accessibility": ["Every control has a label; errors and results are announced."],
      "citations": "required",
      "notes": "Supports single/multiple choice, true-false, short answer, matching, numerical, essay and description. Essay needs human grading."
    },
    {
      "id": "gift.single-choice",
      "family": "practise",
      "label": "GIFT single choice",
      "purpose": "Assess one source-supported best answer with an explanation.",
      "objectiveVerbs": ["recall", "apply", "choose"],
      "authoring": "api-generated",
      "runtime": { "kind": "topic-type", "key": "gift" },
      "tracking": ["attempted", "answered", "scored", "completed", "passed", "failed", "resumed"],
      "fallback": "Question, options and explanation as text",
      "accessibility": ["Radio controls, errors and feedback need labels and announcements."],
      "citations": "required"
    },
    {
      "id": "gift.multiple-choice",
      "family": "practise",
      "label": "GIFT multiple response",
      "purpose": "Assess several source-supported correct choices with an explanation.",
      "objectiveVerbs": ["identify", "classify", "apply"],
      "authoring": "api-generated",
      "runtime": { "kind": "topic-type", "key": "gift" },
      "tracking": ["attempted", "answered", "scored", "completed", "passed", "failed", "resumed"],
      "fallback": "Question, options and explanation as text",
      "accessibility": ["Checkbox controls, errors and feedback need labels and announcements."],
      "citations": "required"
    },
    {
      "id": "gift.true-false",
      "family": "recall",
      "label": "GIFT true/false",
      "purpose": "Check one source-supported binary claim with explanatory feedback.",
      "objectiveVerbs": ["recognise", "verify", "recall"],
      "authoring": "api-generated",
      "runtime": { "kind": "topic-type", "key": "gift" },
      "tracking": ["attempted", "answered", "scored", "completed", "passed", "failed", "resumed"],
      "fallback": "Statement, answer and explanation as text",
      "accessibility": ["Controls and feedback need labels and announcements."],
      "citations": "required"
    },
    {
      "id": "gift.short-answer",
      "family": "recall",
      "label": "GIFT short answer",
      "purpose": "Require learners to retrieve a short source-supported answer.",
      "objectiveVerbs": ["recall", "name", "complete"],
      "authoring": "api-generated",
      "runtime": { "kind": "topic-type", "key": "gift" },
      "tracking": ["attempted", "answered", "scored", "completed", "passed", "failed", "resumed"],
      "fallback": "Question and answer as text",
      "accessibility": ["The input needs a label and accepted variants must not depend on punctuation alone."],
      "citations": "required"
    },
    {
      "id": "gift.matching",
      "family": "arrange",
      "label": "GIFT matching",
      "purpose": "Match source-supported terms, examples or paired concepts.",
      "objectiveVerbs": ["match", "associate", "classify"],